produit,prix
Adata Flash Disk - C906 - 64 GB - Noir,"1,450 DA"
Adata Flash Disk 64Go + 2 Adaptateurs Pour Téléphone Dont 1 Gratuit - Usb 64 Gb C906 - Noir,"1,700 DA"
Sandisk Flash Disque OTG Dual Drive (USB3.1 to Micro-USB) SANDISK Ultra Dual Drive m3.0,"1,790 DA - 3,800 DA"
Adata Flash Disque Ultra Rapide Uv150 USB3.2,"2,000 DA - 3,500 DA"
Sandisk Flash Disque Otg Dual Drive (Usb3.1 To Type-C) Sandisk Ultra Dual Drive,"2,790 DA - 4,890 DA"
Adata Flash Disk 32Go + 2 Adaptateurs Pour Téléphone Dont 1 Gratuit - Usb 32 Gb C906 - Noir,"1,600 DA"
Sandisk Flash Disque SanDisk Ultra Flair avec mot de passe,"1,970 DA - 5,990 DA"
Hp Flash Disque Hp Metal,"2,000 DA - 2,400 DA"
Adata Flash Disk 64Go + 1 Adaptateur Type C Gratuit - USB 64 Gb + Cadeau-Noir,"1,800 DA"
Rack Caddy Pour Disque Dure - Sata 2.5'' 9.5Mm - Gris,"1,050 DA"
mac tech Rack Boitier pour disque dur externe USB 3.0 HDD et SSD 2.5 pouces SATA,"2,600 DA"
Sandisk Flash Disque Usb 2.0 - cruzer -,"1,980 DA - 3,580 DA"
Adata Flash Disque Ultra Rapide full métal UV131 USB3.2,"2,400 DA"
Station d'accueil Docking Rack HDD disque dur Clonage SATA IDE XD MS SD CF TF M2,"7,500 DA"
Disque Dur Externe Seagate 4Tb,"25,800 DA"
Adata Flash Disk 32Go + 1 Adaptateur Type C Gratuit - USB 32Gb + Cadeau-Blanc,"1,450 DA"
SNDWAY Power Bank Campus 2500 Mah Blanc,"1,700 DA"
Disque Dur Externe - SEAGATE - Expansion Portable - USB 3.0 Portable Drive,"13,900 DA - 29,500 DA"
Hikvision Flash Disque 2.0 Métallique - M200- 32Gb - Argnet,"1,300 DA"
Disque Dur Externe Seagate 4Tb,"26,000 DA"
Hp Flash Disque Hp Metal,"3,450 DA - 4,450 DA"
Rack Boitier pour disque dur externe USB 3.0 HDD SSD 2.5 pouces SATA,"2,900 DA"
"Disque dur "" 2.5"" 320 go pour pc portable","2,700 DA"
Rack Caddy pour Disque Dure - SATA 2.5'' 12.7mm - Gris,"1,490 DA"
Western Digital WD Elements Disque Dur Externe Portable USB 3.0 - 1TB /2TB /4TB,"13,900 DA - 27,900 DA"
Hp Flash Disque SUPERSONIC Otg Usb3.2/Type-C HP X5600C,"4,500 DA"
Sandisk Flash Disque Otg Dual Drive (Usb3.1 To Type-C) Sandisk Ultra Dual Drive Type-C,"4,290 DA - 4,990 DA"
Sandisk Flash Disque -64GB- Cruzer Blade Flash Drive - Noir/Rouge,"1,999 DA"
Station D'accueil De Disque Dur Avec Multi Lecteur De Carte - Noir / Rouge,"4,500 DA"
Disque Dur Externe Expansion - 1To - Usb 3.0 - Noir,"12,450 DA"
Adata Flash Disk 64/32Go - USB 64/32Gb C906 - Stockage Donnée Noir,"1,400 DA - 1,600 DA"
D-Link Clé wifi Dwa-131 Wireless N Nano Usb Adapter,"1,940 DA"
Hp Flash Disque Mini,"2,250 DA"
Hp Flash Disque Métal 64Go Clé USB 64GB Authentique - Stockage de Données,"2,200 DA"
Kingston Disque Dure A400 SSD SATA 120 GB Kingston 2.5'',"6,200 DA"
"Disque dur 3.5"" 320GO pour pc bureau","2,600 DA"
Adata USB Flash Drive Classic 32gb - C906 - Noir,"1,100 DA"
Sandisk Flash Disque USB 2.0  Cruzer Blade 128 GB - Noir/Rouge,"3,600 DA"
Sandisk Flash Disque OTG Dual Drive (USB3.1 to Micro-USB) SANDISK Ultra Dual Drive m3.0,"2,040 DA - 2,740 DA"
Sandisk Flash Disque Otg Dual Drive (Usb3.1 To Type-C) Sandisk Ultra Dual Drive Usb Type-C,"2,800 DA - 4,900 DA"
